{
  "schema_version": "1.0.0",
  "architecture_version": "2.1.0",
  "document_path": "docs/ai-engineering-framework/84-framework-canonical-registry-architecture.md",
  "artifact_root": "docs/ai-engineering-framework/fcr",
  "schemas": [
    "docs/ai-engineering-framework/fcr/errors/schemas/error-authority.schema.json",
    "docs/ai-engineering-framework/fcr/errors/schemas/error-context.schema.json",
    "docs/ai-engineering-framework/fcr/errors/schemas/error-dependency.schema.json",
    "docs/ai-engineering-framework/fcr/errors/schemas/error-evidence.schema.json",
    "docs/ai-engineering-framework/fcr/errors/schemas/error-identity.schema.json",
    "docs/ai-engineering-framework/fcr/errors/schemas/error-lifecycle.schema.json",
    "docs/ai-engineering-framework/fcr/errors/schemas/error-persistence.schema.json",
    "docs/ai-engineering-framework/fcr/errors/schemas/error-repository.schema.json",
    "docs/ai-engineering-framework/fcr/errors/schemas/error-resolution.schema.json",
    "docs/ai-engineering-framework/fcr/errors/schemas/error-scope.schema.json",
    "docs/ai-engineering-framework/fcr/errors/schemas/error-validation.schema.json",
    "docs/ai-engineering-framework/fcr/errors/schemas/error-validator.schema.json",
    "docs/ai-engineering-framework/fcr/schemas/acceptance-criterion-ref.schema.json",
    "docs/ai-engineering-framework/fcr/schemas/bootstrap-evidence.schema.json",
    "docs/ai-engineering-framework/fcr/schemas/bootstrap-rollback-record.schema.json",
    "docs/ai-engineering-framework/fcr/schemas/common-types.schema.json",
    "docs/ai-engineering-framework/fcr/schemas/authority-record.schema.json",
    "docs/ai-engineering-framework/fcr/schemas/bootstrap-record.schema.json",
    "docs/ai-engineering-framework/fcr/schemas/context-record.schema.json",
    "docs/ai-engineering-framework/fcr/schemas/contract-record.schema.json",
    "docs/ai-engineering-framework/fcr/schemas/context-candidate.schema.json",
    "docs/ai-engineering-framework/fcr/schemas/context-selection-request.schema.json",
    "docs/ai-engineering-framework/fcr/schemas/context-selection-response.schema.json",
    "docs/ai-engineering-framework/fcr/schemas/contract-ref.schema.json",
    "docs/ai-engineering-framework/fcr/schemas/dependency-override.schema.json",
    "docs/ai-engineering-framework/fcr/schemas/dependency-record.schema.json",
    "docs/ai-engineering-framework/fcr/schemas/dependency-ref.schema.json",
    "docs/ai-engineering-framework/fcr/schemas/dependency-registry.schema.json",
    "docs/ai-engineering-framework/fcr/schemas/document-record.schema.json",
    "docs/ai-engineering-framework/fcr/schemas/document-ref.schema.json",
    "docs/ai-engineering-framework/fcr/schemas/document-registry.schema.json",
    "docs/ai-engineering-framework/fcr/schemas/evidence-evaluation-algorithm.schema.json",
    "docs/ai-engineering-framework/fcr/schemas/evidence-predicate.schema.json",
    "docs/ai-engineering-framework/fcr/schemas/evidence-record.schema.json",
    "docs/ai-engineering-framework/fcr/schemas/evidence-ref.schema.json",
    "docs/ai-engineering-framework/fcr/schemas/evidence-registry.schema.json",
    "docs/ai-engineering-framework/fcr/schemas/external-prerequisite-request.schema.json",
    "docs/ai-engineering-framework/fcr/schemas/external-prerequisite-response.schema.json",
    "docs/ai-engineering-framework/fcr/schemas/field-provenance.schema.json",
    "docs/ai-engineering-framework/fcr/schemas/framework-error-catalog.schema.json",
    "docs/ai-engineering-framework/fcr/schemas/framework-error.schema.json",
    "docs/ai-engineering-framework/fcr/schemas/lifecycle-drift-report.schema.json",
    "docs/ai-engineering-framework/fcr/schemas/lifecycle-reconciliation-request.schema.json",
    "docs/ai-engineering-framework/fcr/schemas/lifecycle-reconciliation-response.schema.json",
    "docs/ai-engineering-framework/fcr/schemas/lifecycle-state-read-request.schema.json",
    "docs/ai-engineering-framework/fcr/schemas/lifecycle-state-read-response.schema.json",
    "docs/ai-engineering-framework/fcr/schemas/lifecycle-transition-request.schema.json",
    "docs/ai-engineering-framework/fcr/schemas/lifecycle-transition-response.schema.json",
    "docs/ai-engineering-framework/fcr/schemas/lock-record.schema.json",
    "docs/ai-engineering-framework/fcr/schemas/lock-transition-record.schema.json",
    "docs/ai-engineering-framework/fcr/schemas/module-dependency-ref.schema.json",
    "docs/ai-engineering-framework/fcr/schemas/module-record.schema.json",
    "docs/ai-engineering-framework/fcr/schemas/module-registry.schema.json",
    "docs/ai-engineering-framework/fcr/schemas/operation-failure.schema.json",
    "docs/ai-engineering-framework/fcr/schemas/ownership-registry.schema.json",
    "docs/ai-engineering-framework/fcr/schemas/path-rule.schema.json",
    "docs/ai-engineering-framework/fcr/schemas/precondition-record-current.schema.json",
    "docs/ai-engineering-framework/fcr/schemas/projection-record.schema.json",
    "docs/ai-engineering-framework/fcr/schemas/registry-index.schema.json",
    "docs/ai-engineering-framework/fcr/schemas/registry-revision-manifest.schema.json",
    "docs/ai-engineering-framework/fcr/schemas/registry-revision.schema.json",
    "docs/ai-engineering-framework/fcr/schemas/task-namespace-record.schema.json",
    "docs/ai-engineering-framework/fcr/schemas/task-namespace-registry.schema.json",
    "docs/ai-engineering-framework/fcr/schemas/task-record.schema.json",
    "docs/ai-engineering-framework/fcr/schemas/task-registry.schema.json",
    "docs/ai-engineering-framework/fcr/schemas/task-scope-override.schema.json",
    "docs/ai-engineering-framework/fcr/schemas/test-requirement.schema.json",
    "docs/ai-engineering-framework/fcr/schemas/transaction-record.schema.json",
    "docs/ai-engineering-framework/fcr/schemas/transition-rule.schema.json",
    "docs/ai-engineering-framework/fcr/schemas/validator-adapter-request.schema.json",
    "docs/ai-engineering-framework/fcr/schemas/validator-adapter-response.schema.json",
    "docs/ai-engineering-framework/fcr/schemas/validator-snapshot.schema.json"
  ],
  "contracts": [
    "docs/ai-engineering-framework/fcr/contracts/cancel-preparation.contract.json",
    "docs/ai-engineering-framework/fcr/contracts/cancel-preparation.failure.schema.json",
    "docs/ai-engineering-framework/fcr/contracts/cancel-preparation.request.schema.json",
    "docs/ai-engineering-framework/fcr/contracts/cancel-preparation.success.schema.json",
    "docs/ai-engineering-framework/fcr/contracts/commit-candidate-transaction.contract.json",
    "docs/ai-engineering-framework/fcr/contracts/commit-candidate-transaction.failure.schema.json",
    "docs/ai-engineering-framework/fcr/contracts/commit-candidate-transaction.request.schema.json",
    "docs/ai-engineering-framework/fcr/contracts/commit-candidate-transaction.success.schema.json",
    "docs/ai-engineering-framework/fcr/contracts/fcr-v2-001-validate-manifest.contract.json",
    "docs/ai-engineering-framework/fcr/contracts/fcr-v2-001-validate-manifest.failure.schema.json",
    "docs/ai-engineering-framework/fcr/contracts/fcr-v2-001-validate-manifest.request.schema.json",
    "docs/ai-engineering-framework/fcr/contracts/fcr-v2-001-validate-manifest.success.schema.json",
    "docs/ai-engineering-framework/fcr/contracts/fcr-v2-002-validate-scope.contract.json",
    "docs/ai-engineering-framework/fcr/contracts/fcr-v2-002-validate-scope.failure.schema.json",
    "docs/ai-engineering-framework/fcr/contracts/fcr-v2-002-validate-scope.request.schema.json",
    "docs/ai-engineering-framework/fcr/contracts/fcr-v2-002-validate-scope.success.schema.json",
    "docs/ai-engineering-framework/fcr/contracts/fcr-v2-003-validate-preflight.contract.json",
    "docs/ai-engineering-framework/fcr/contracts/fcr-v2-003-validate-preflight.failure.schema.json",
    "docs/ai-engineering-framework/fcr/contracts/fcr-v2-003-validate-preflight.request.schema.json",
    "docs/ai-engineering-framework/fcr/contracts/fcr-v2-003-validate-preflight.success.schema.json",
    "docs/ai-engineering-framework/fcr/contracts/map-response-status-to-fcr-result.contract.json",
    "docs/ai-engineering-framework/fcr/contracts/map-response-status-to-fcr-result.failure.schema.json",
    "docs/ai-engineering-framework/fcr/contracts/map-response-status-to-fcr-result.request.schema.json",
    "docs/ai-engineering-framework/fcr/contracts/map-response-status-to-fcr-result.success.schema.json",
    "docs/ai-engineering-framework/fcr/contracts/query-preparation-status.contract.json",
    "docs/ai-engineering-framework/fcr/contracts/query-preparation-status.failure.schema.json",
    "docs/ai-engineering-framework/fcr/contracts/query-preparation-status.request.schema.json",
    "docs/ai-engineering-framework/fcr/contracts/query-preparation-status.success.schema.json",
    "docs/ai-engineering-framework/fcr/contracts/read-candidate-output.contract.json",
    "docs/ai-engineering-framework/fcr/contracts/read-candidate-output.failure.schema.json",
    "docs/ai-engineering-framework/fcr/contracts/read-candidate-output.request.schema.json",
    "docs/ai-engineering-framework/fcr/contracts/read-candidate-output.success.schema.json",
    "docs/ai-engineering-framework/fcr/contracts/read-dependency-status.contract.json",
    "docs/ai-engineering-framework/fcr/contracts/read-dependency-status.failure.schema.json",
    "docs/ai-engineering-framework/fcr/contracts/read-dependency-status.request.schema.json",
    "docs/ai-engineering-framework/fcr/contracts/read-dependency-status.success.schema.json",
    "docs/ai-engineering-framework/fcr/contracts/read-dispatchable-task.contract.json",
    "docs/ai-engineering-framework/fcr/contracts/read-dispatchable-task.failure.schema.json",
    "docs/ai-engineering-framework/fcr/contracts/read-dispatchable-task.request.schema.json",
    "docs/ai-engineering-framework/fcr/contracts/read-dispatchable-task.success.schema.json",